{
  "schema_version": "2026-07",
  "as_of": "2026-07-12",
  "currency": "CAD",
  "dollars": "nominal",
  "jurisdiction": {
    "country": "canada",
    "province": "quebec"
  },
  "people": [
    {
      "id": "p1",
      "label": "primary",
      "legal_name": null,
      "birth_date": "1980-03-14",
      "death_date": null,
      "residency": {
        "province": "quebec",
        "since": "1980-03-14"
      },
      "relationships": [
        {
          "type": "spouse_of",
          "person": "p2",
          "from": "2008-06-21",
          "to": null
        },
        {
          "type": "parent_of",
          "person": "ca",
          "from": null,
          "to": null
        },
        {
          "type": "parent_of",
          "person": "cb",
          "from": null,
          "to": null
        }
      ],
      "incomes": [
        {
          "id": "p1_employment",
          "kind": "employment",
          "amount": 118000,
          "from": "2015-01-01",
          "to": null,
          "employer_rrsp_match": {
            "into_account": "p1_rrsp",
            "pct": 0.03,
            "max": 3900
          },
          "employment": {
            "non_compete": {
              "months": 12,
              "scope": "payments technology",
              "geography": "Canada"
            },
            "probation_end": null,
            "notice_days": 0
          }
        }
      ],
      "study_periods": [],
      "room": {
        "rrsp": {
          "contribution_room": 42000,
          "as_of": "2026-01-01"
        },
        "tfsa": {
          "contribution_room": 18000,
          "as_of": "2026-01-01"
        },
        "fhsa": null,
        "resp": null
      }
    },
    {
      "id": "p2",
      "label": "spouse",
      "legal_name": null,
      "birth_date": "1982-09-02",
      "death_date": null,
      "residency": {
        "province": "quebec",
        "since": "1982-09-02"
      },
      "relationships": [
        {
          "type": "parent_of",
          "person": "ca",
          "from": null,
          "to": null
        },
        {
          "type": "parent_of",
          "person": "cb",
          "from": null,
          "to": null
        }
      ],
      "incomes": [
        {
          "id": "p2_employment",
          "kind": "employment",
          "amount": 96000,
          "from": "2018-03-01",
          "to": null,
          "employer_rrsp_match": null
        }
      ],
      "study_periods": [],
      "room": {
        "rrsp": {
          "contribution_room": 31000,
          "as_of": "2026-01-01"
        },
        "tfsa": {
          "contribution_room": 26000,
          "as_of": "2026-01-01"
        },
        "fhsa": null,
        "resp": null
      }
    },
    {
      "id": "ca",
      "label": "child_a",
      "legal_name": null,
      "birth_date": "2010-04-22",
      "death_date": null,
      "residency": {
        "province": "quebec",
        "since": "2010-04-22"
      },
      "relationships": [],
      "incomes": [],
      "study_periods": [
        {
          "institution": "Lycee Synthetique",
          "program": "Secondary V",
          "start_date": "2025-08-25",
          "end_date": "2026-06-20"
        }
      ],
      "room": {
        "rrsp": null,
        "tfsa": null,
        "fhsa": null,
        "resp": {
          "contribution_room": 4000,
          "as_of": "2026-01-01"
        }
      }
    },
    {
      "id": "cb",
      "label": "child_b",
      "legal_name": null,
      "birth_date": "2013-01-09",
      "death_date": null,
      "residency": {
        "province": "quebec",
        "since": "2013-01-09"
      },
      "relationships": [],
      "incomes": [],
      "study_periods": [],
      "room": {
        "rrsp": null,
        "tfsa": null,
        "fhsa": null,
        "resp": {
          "contribution_room": 4000,
          "as_of": "2026-01-01"
        }
      }
    }
  ],
  "accounts": [
    {
      "id": "p1_rrsp",
      "owner": "p1",
      "kind": "rrsp",
      "balance": {
        "amount": 210000,
        "as_of": "2026-06-30"
      },
      "acb": null,
      "holdings": [
        {
          "product": "synthetic_global_equity_index",
          "weight": 1.0
        }
      ],
      "beneficiary": "p2",
      "successor_holder": null
    },
    {
      "id": "p2_rrsp",
      "owner": "p2",
      "kind": "rrsp",
      "balance": {
        "amount": 95000,
        "as_of": "2026-06-30"
      },
      "acb": null,
      "holdings": [
        {
          "product": "synthetic_global_equity_index",
          "weight": 1.0
        }
      ],
      "beneficiary": "p1",
      "successor_holder": null
    },
    {
      "id": "spousal_rrsp_p2",
      "owner": "p2",
      "kind": "spousal_rrsp",
      "balance": {
        "amount": 60000,
        "as_of": "2026-06-30"
      },
      "acb": null,
      "holdings": [
        {
          "product": "synthetic_global_equity_index",
          "weight": 1.0
        }
      ],
      "beneficiary": "p1",
      "successor_holder": null,
      "contributors": [
        "p1"
      ]
    },
    {
      "id": "p1_tfsa",
      "owner": "p1",
      "kind": "tfsa",
      "balance": {
        "amount": 71000,
        "as_of": "2026-06-30"
      },
      "acb": null,
      "holdings": [
        {
          "product": "synthetic_global_equity_index",
          "weight": 1.0
        }
      ],
      "beneficiary": "p2",
      "successor_holder": "p2"
    },
    {
      "id": "p2_tfsa",
      "owner": "p2",
      "kind": "tfsa",
      "balance": {
        "amount": 54000,
        "as_of": "2026-06-30"
      },
      "acb": null,
      "holdings": [
        {
          "product": "synthetic_global_equity_index",
          "weight": 1.0
        }
      ],
      "beneficiary": "p1",
      "successor_holder": "p1"
    },
    {
      "id": "p2_lira",
      "owner": "p2",
      "kind": "lira",
      "balance": {
        "amount": 38000,
        "as_of": "2026-06-30"
      },
      "acb": null,
      "holdings": [
        {
          "product": "synthetic_fixed_income_index",
          "weight": 1.0
        }
      ],
      "beneficiary": "p1",
      "successor_holder": null,
      "lira": {
        "jurisdiction": "quebec",
        "source_pension_plan": "Former employer DC plan",
        "transfer_date": "2016-04-01",
        "reference_rate": 0.045
      }
    },
    {
      "id": "joint_nonreg",
      "owner": {
        "joint": [
          {
            "person": "p1",
            "pct": 0.5
          },
          {
            "person": "p2",
            "pct": 0.5
          }
        ]
      },
      "kind": "non_reg",
      "balance": {
        "amount": 85000,
        "as_of": "2026-06-30"
      },
      "acb": 62000,
      "holdings": [
        {
          "product": "synthetic_global_equity_index",
          "weight": 0.7
        },
        {
          "product": "synthetic_fixed_income_index",
          "weight": 0.3
        }
      ],
      "beneficiary": null,
      "successor_holder": null
    },
    {
      "id": "family_resp",
      "owner": {
        "joint": [
          {
            "person": "p1",
            "pct": 0.5
          },
          {
            "person": "p2",
            "pct": 0.5
          }
        ]
      },
      "kind": "resp",
      "balance": {
        "amount": 46000,
        "as_of": "2026-06-30"
      },
      "acb": null,
      "holdings": [
        {
          "product": "synthetic_balanced_index",
          "weight": 1.0
        }
      ],
      "beneficiary": null,
      "successor_holder": null,
      "resp": {
        "subscribers": [
          "p1",
          "p2"
        ],
        "beneficiaries": [
          {
            "person": "ca",
            "contributions_total": 20000,
            "contributions_before_age_15": 20000,
            "cesg_basic_received": 3600,
            "cesg_additional_received": 400,
            "qesi_received": 2000,
            "clb_received": 0,
            "years_with_100_before_age_15": 10
          },
          {
            "person": "cb",
            "contributions_total": 12000,
            "contributions_before_age_15": 12000,
            "cesg_basic_received": 2400,
            "cesg_additional_received": 0,
            "qesi_received": 1200,
            "clb_received": 0,
            "years_with_100_before_age_15": 6
          }
        ],
        "contributions_total": 32000,
        "cesg_received": 6400,
        "qesi_received": 3200,
        "clb_received": 0
      }
    },
    {
      "id": "p2_fhsa",
      "owner": "p2",
      "kind": "fhsa",
      "balance": {
        "amount": 12000,
        "as_of": "2026-06-30"
      },
      "acb": null,
      "holdings": [
        {
          "product": "synthetic_fixed_income_index",
          "weight": 1.0
        }
      ],
      "beneficiary": "p1",
      "successor_holder": null,
      "fhsa": {
        "opened_date": "2023-05-01",
        "first_time_buyer_since": "2023-05-01"
      }
    },
    {
      "id": "p1_lsif",
      "owner": "p1",
      "kind": "lsif",
      "balance": {
        "amount": 15000,
        "as_of": "2026-06-30"
      },
      "acb": null,
      "holdings": [
        {
          "product": "synthetic_balanced_index",
          "weight": 1.0
        }
      ],
      "beneficiary": "p2",
      "successor_holder": null,
      "lsif": {
        "purchase_date": "2020-03-01",
        "purchase_province": "quebec",
        "federally_registered": true,
        "prior_redemption": false,
        "is_hbp_replacement": false,
        "quebec_carryforward": 0,
        "acquisition_date": "2020-03-01",
        "redeemed_date": null,
        "reference_year_taxable_income": null
      }
    }
  ],
  "liabilities": [
    {
      "id": "mortgage_main",
      "owner": {
        "joint": [
          {
            "person": "p1",
            "pct": 0.5
          },
          {
            "person": "p2",
            "pct": 0.5
          }
        ]
      },